{
  "id": "us-td-ameritrade-client-rewards",
  "schema_version": "1.0.0",
  "name": "TD Ameritrade Client Rewards Card",
  "localized_names": {
    "en": "TD Ameritrade Client Rewards Card"
  },
  "country": "us",
  "issuer": "TD Bank",
  "issuer_id": "td",
  "network": "visa",
  "network_tier": "none",
  "type": "credit",
  "status": "discontinued",
  "discontinued_date": "2021-10-06",
  "replaced_by": "us-td-cash",
  "annual_fee": {
    "amount": null,
    "currency": "USD",
    "first_year": null,
    "waiver_conditions": null
  },
  "apr": {
    "purchase": {
      "min": null,
      "max": null,
      "type": null
    },
    "cash_advance": {
      "min": null,
      "max": null,
      "type": null
    },
    "notes": "APR not available; product is discontinued and the official FAQ PDF is the only remaining source."
  },
  "fx_fee": {
    "percent": null,
    "notes": "Foreign transaction fee not documented in the remaining source."
  },
  "credit_required": {
    "score_band": null,
    "notes": null
  },
  "rewards": {
    "currency": "points",
    "currency_label": "Reward points",
    "structure": "multi",
    "base_rate": {
      "points_per_dollar": null,
      "description": "Historical earning rates are not documented in the remaining official transition FAQ."
    },
    "categories": [],
    "redemption_notes": "The official transition FAQ states that September 24 was the last day to redeem Client Rewards for a 10% bonus into an eligible TD Ameritrade account. Remaining Client Rewards transferred to TD Cash on October 6, 2021; this redemption bonus was not a purchase earning multiplier.",
    "rate_type": "points_multiplier"
  },
  "signup_bonus": null,
  "benefits": [
    {
      "id": "brokerage-redemption",
      "title": "Redeem Points to TD Ameritrade Brokerage Account",
      "category": "other",
      "source": "issuer",
      "description": "Cardholders could redeem reward points for cash back deposited into a linked TD Ameritrade brokerage account."
    }
  ],
  "travel_perks": {
    "lounge_access": null,
    "tsa_precheck_credit": null,
    "global_entry_credit": null,
    "free_checked_bags": null,
    "hotel_status": null,
    "other": []
  },
  "official_url": "https://tdaclientrewards.tdbank.com/products/TDA/pdfs/tda-faq.pdf",
  "image": {
    "url": "https://web.archive.org/web/20150919162659im_/https://tdaclientrewards.tdbank.com/DATAHELIX/TD/MEMBRE_GROUPE/4_cardArt.jpg",
    "attribution": "© TD Bank",
    "local_path": null
  },
  "secondary_sources": [
    "https://www.doctorofcredit.com/spreadsheet-current-recent-credit-card-signup-bonuses-major-issuers/"
  ],
  "bin_hints": [],
  "last_verified": "2026-10-19",
  "sources": [
    "https://tdaclientrewards.tdbank.com/products/TDA/pdfs/tda-faq.pdf",
    "https://web.archive.org/web/20150930103800/https://tdaclientrewards.tdbank.com/"
  ],
  "notes": "The official transition FAQ says the program ended and eligible accounts converted to TD Cash on October 6, 2021, after Charles Schwab acquired TD Ameritrade. The opening answer, next-steps answer and rewards section repeat the 2021 conversion date; the mail-arrival answer inconsistently prints October 6, 2020. Historical purchase earning rates and fees are not documented in this FAQ and are left unknown rather than reconstructed. The FAQ documents brokerage-account redemption, not a 2x earning category for brokerage deposits. Historical artwork provenance (checked 2026-10-21): the retained 2015-09-30 archive of the official TD Ameritrade Client Rewards site shows this image with alt text \"TD Ameritrade Client Rewards Card Visa card\". The linked image resolves to a 2015-09-19 archive capture of the TD Bank-hosted asset and was visually inspected as the white TD Ameritrade Client Rewards card; the pictured face carries a Visa Signature mark, which is recorded here as an observation only and does not change network_tier. It is a low-resolution 200x126 historical image; it is not evidence of lifecycle or the financial fields, which were not reverified in this artwork-only update.",
  "segment": "personal"
}
