{
  "id": "ca-td-aeroplan-visa-business",
  "schema_version": "1.0.0",
  "name": "TD Aeroplan Visa Business Card",
  "localized_names": {
    "en": "TD Aeroplan Visa Business Card"
  },
  "country": "ca",
  "issuer": "TD",
  "issuer_id": "td",
  "network": "visa",
  "network_tier": "none",
  "type": "credit",
  "segment": "business",
  "status": "active",
  "annual_fee": {
    "amount": 149,
    "currency": "CAD",
    "first_year": 149,
    "waiver_conditions": null
  },
  "apr": {
    "purchase": {
      "min": 14.99,
      "max": 14.99,
      "type": "variable"
    },
    "cash_advance": {
      "min": 22.99,
      "max": 22.99,
      "type": "variable"
    },
    "notes": "14.99% on purchases; 22.99% on cash advances."
  },
  "fx_fee": {
    "percent": null,
    "notes": null
  },
  "credit_required": {
    "score_band": null,
    "notes": "Canadian resident who has reached the age of majority in their province or territory."
  },
  "rewards": {
    "currency": "aeroplan",
    "currency_label": "Aeroplan points",
    "structure": "multi",
    "base_rate": {
      "points_per_dollar": 1,
      "description": "1 Aeroplan point per $1 on all other eligible purchases."
    },
    "categories": [
      {
        "label": "Air Canada purchases including Air Canada Vacations (bonus rates share an $80,000 annual cap)",
        "points_per_dollar": 2,
        "cap": null
      },
      {
        "label": "Participating Hyatt hotels and resorts (first $80,000 a year)",
        "points_per_dollar": 2,
        "cap": {
          "amount": 80000,
          "currency": "CAD",
          "period": "year"
        }
      },
      {
        "label": "Travel and transit, dining, EV charging, shipping, internet, cable and phone services (bonus rates share an $80,000 annual cap)",
        "points_per_dollar": 1.5,
        "cap": null
      }
    ],
    "redemption_notes": "Aeroplan points redeem for Air Canada and partner flights and other Aeroplan rewards.",
    "rate_type": "points_multiplier"
  },
  "signup_bonus": {
    "amount": 60000,
    "unit": "points",
    "spend_required": null,
    "spend_currency": null,
    "months": 12,
    "description": "10,000 Aeroplan points after the first purchase, 30,000 after $15,000 in the first 180 days, and 20,000 after $25,000 in the first 365 days.",
    "as_of": "2026-10-22"
  },
  "benefits": [],
  "travel_perks": null,
  "official_url": "https://www.td.com/ca/en/business-banking/small-business/credit-cards/aeroplan-visa-business-card",
  "image": null,
  "bin_hints": [],
  "last_verified": "2026-10-22",
  "sources": [
    "https://www.td.com/ca/en/business-banking/small-business/credit-cards/aeroplan-visa-business-card"
  ],
  "notes": "The issuer page does not name a network package tier, so network_tier is none."
}
